{"algorithmVersion":"hydrology-reconcile-fixed-v1","artifactVersion":1,"canonicalChecksum":"e1a3296404efa29599fe5189333829058a9b57650392ce15bd6c499ee53473c9","finalStateChecksum":"7b0651bc726ffad57d4b7e719a74d2e6b556ca4357fd5672a8649c4a92d25593","finalValues":[{"hardLocked":true,"valueMillionths":0,"variableId":"delta.example.mouth.0000"}],"iterationsExecuted":3,"residuals":[{"actualDeltaMillionths":0,"constraintId":"reconcile.delta.delta-example.mouth.0000","correctionCount":0,"failureReason":"UNRECOVERABLE_CONNECTION","featureId":"delta-example","kind":"DELTA_MOUTH","leftVariableId":null,"maximumDeltaMillionths":1,"minimumDeltaMillionths":1,"residualMillionths":1,"rightVariableId":"delta.example.mouth.0000","satisfied":false}],"resources":{"constraintCount":1,"estimatedArtifactBytes":5760,"iterationsExecuted":3,"maximumArtifactBytes":4194304,"maximumWorkUnits":100000000,"maximumWorkingBytes":268435456,"peakWorkingBytes":9088,"resourceVersion":"hydrology-reconciliation-resource-v1","variableCount":1,"workUnits":5},"resultChecksum":"3f3135e0027f5f7c61dc7a9589a6c9a6d2e1972447a1f52bae742340fe06b4ea","scanOrderVersion":"kind-feature-constraint-v3","sourceBlueprintChecksum":"bbbbbbbbbbbbbbbbbbbbbbbbbbbbbbbbbbbbbbbbbbbbbbbbbbbbbbbbbbbbbbbb","sourcePlanChecksum":"d98497be42c39a33b29bfc98bcebe26f1e8c0f937024280525e441fb858bf451","sourceStateChecksum":"7b0651bc726ffad57d4b7e719a74d2e6b556ca4357fd5672a8649c4a92d25593","status":"FAILED"}